{
  "$schema": "https://json-schema.org/draft/2020-12/schema",
  "$id": "https://journeys.tryscope.com/schemas/journeys/1/policy",
  "title": "scope.policy/1",
  "description": "The configuration the sensor fetches. Immutable integer versions per customer; public to the customer; holds no secret (the sensor's validator refuses a secret-shaped value). A sensor that does not know a section ignores it; a rule kind it does not know runs as a skipped decision.",
  "$defs": {
    "regex": { "type": "string", "description": "a JavaScript regular expression over the path; anchored at the start by the compiler when it does not begin with ^" },
    "regexList": { "type": "array", "items": { "$ref": "#/$defs/regex" } },
    "route": { "type": "string", "enum": ["docs", "docs_root", "download", "api", "mcp", "oauth.register", "oauth.authorize", "oauth.token", "oauth.approve", "device.start", "device.poll", "device.approve", "signup", "hooks.create", "hooks.catch", "credentials", "trial", "finder", "cli.init", "cli.beacon", "passthrough", "other"] },
    "faceRewrite": {
      "type": "object",
      "required": ["pattern", "replacement"],
      "properties": {
        "pattern": { "type": "string", "description": "a regular expression over the page body with {host} filled in; applied globally" },
        "replacement": { "type": "string", "description": "the replacement with $1.. groups and {host}, {prefix}, {token} filled in" }
      },
      "additionalProperties": false
    },
    "fieldNames": { "type": "object", "additionalProperties": { "oneOf": [{ "type": "string" }, { "type": "array", "items": { "type": "string" } }] }, "description": "the body field names a door's keys live in, by key kind; a sensor and the stitcher read the same names" },
    "bodyMatch": { "type": "object", "required": ["field", "value"], "properties": { "field": { "type": "string" }, "value": {} }, "additionalProperties": false, "description": "a body field and the value that means success" },
    "door": {
      "oneOf": [
        { "$ref": "#/$defs/regex" },
        { "type": "object", "required": ["path"], "properties": { "path": { "$ref": "#/$defs/regex" }, "fields": { "$ref": "#/$defs/fieldNames" } }, "additionalProperties": false }
      ],
      "description": "a door: its path pattern, or the pattern with the field names its keys live in"
    }
  },
  "type": "object",
  "required": ["schema", "version", "secrets", "headers", "forward", "rules"],
  "anyOf": [{ "required": ["routes"] }, { "required": ["surfaces"] }],
  "properties": {
    "schema": { "const": "scope.policy/1" },
    "version": { "type": "integer", "minimum": 0, "description": "the customer's policy version; 0 is the embedded forward-only default" },
    "about": { "type": "string" },
    "origin": { "type": ["string", "null"], "description": "the origin to forward to when the adapter has none configured (a Worker on workers.dev needs one; a route in the customer's zone does not)" },
    "report": {
      "type": "object",
      "required": ["url"],
      "properties": {
        "url": { "type": "string", "description": "where records ship; the product's policy sets the API's requests endpoint" },
        "key_header": { "type": "string", "description": "the header that carries the install key on shipments; the default is Authorization: Bearer" },
        "kinds": { "type": "object", "description": "reserved" }
      },
      "additionalProperties": false
    },
    "routes": {
      "type": "object",
      "description": "the regular-expression form: four expressions over the path plus the text faces; a policy with surfaces ignores every key but run_prefix",
      "properties": {
        "run_prefix": { "$ref": "#/$defs/regex", "description": "a path prefix with two capture groups (the prefix, the rest): the path up to the rest group is stripped before classification and restored in rewritten links as {prefix}, whatever the first group captures" },
        "passthrough": { "$ref": "#/$defs/regex" },
        "not_content": { "$ref": "#/$defs/regex" },
        "observed": { "$ref": "#/$defs/regex" },
        "text_faces": { "$ref": "#/$defs/regex", "description": "plain-text documents that are pages (a root map such as llms.txt)" }
      },
      "additionalProperties": false
    },
    "surfaces": {
      "type": "object",
      "description": "the surface map: the roles of the product's paths, derived from the standards (MCP is one JSON-RPC endpoint carrying MCP-Session-Id and MCP-Protocol-Version; OAuth 2.1 names its registration (RFC 7591), authorization, token and device-authorization (RFC 8628) endpoints in its metadata documents (RFC 8414, RFC 9728); an API call carries a bearer) plus a short custom list. Classification precedence, first match wins: passthrough, custom (in order), finder, mcp, oauth.register, oauth.authorize, oauth.token, oauth.approve, device.start, device.poll, device.approve, hooks.create, hooks.catch, credentials, trial, cli.init, cli.beacon, signup, download, api, docs.llms and docs.root (docs_root), docs.paths (docs), else other.",
      "properties": {
        "docs": {
          "type": "object",
          "properties": {
            "paths": { "$ref": "#/$defs/regexList", "description": "documentation pages: observed, content, references minted per serve" },
            "root": { "$ref": "#/$defs/regex", "description": "the site root or docs root page" },
            "llms": { "$ref": "#/$defs/regex", "description": "the root map (llms.txt), a plain-text page" },
            "faces": {
              "type": "object",
              "properties": { "md": { "$ref": "#/$defs/regexList" }, "txt": { "$ref": "#/$defs/regexList" } },
              "additionalProperties": false,
              "description": "paths whose face is markdown or text regardless of the answer's content type"
            }
          },
          "additionalProperties": false
        },
        "download": { "type": "object", "properties": { "paths": { "$ref": "#/$defs/regexList" } }, "additionalProperties": false, "description": "installer and package downloads: an opener of an install journey when the url carries a reference" },
        "api": {
          "type": "object",
          "properties": {
            "paths": { "$ref": "#/$defs/regexList" },
            "credential_header": { "type": "string", "default": "authorization" },
            "actions": { "$ref": "#/$defs/regexList", "description": "the API paths that are actions (a step with an outcome) rather than reads" },
            "action_success": { "$ref": "#/$defs/bodyMatch", "description": "what a successful action's answer says; absent means any 2xx" }
          },
          "additionalProperties": false
        },
        "mcp": { "type": "object", "properties": { "path": { "$ref": "#/$defs/regex" } }, "additionalProperties": false },
        "oauth": {
          "type": "object",
          "properties": {
            "metadata": { "$ref": "#/$defs/regex", "description": "RFC 8414 authorization-server metadata; classified as api" },
            "resource_metadata": { "$ref": "#/$defs/regex", "description": "RFC 9728 protected-resource metadata; classified as api" },
            "register": { "$ref": "#/$defs/regex", "description": "RFC 7591 dynamic client registration" },
            "authorize": { "$ref": "#/$defs/regex" },
            "token": { "$ref": "#/$defs/regex" },
            "approve": { "$ref": "#/$defs/regex", "description": "the product's consent post" },
            "fields": { "$ref": "#/$defs/fieldNames", "description": "client_id (default client_id), credential (default access_token)" }
          },
          "additionalProperties": false
        },
        "device": {
          "type": "object",
          "properties": {
            "start": { "$ref": "#/$defs/regex", "description": "RFC 8628 device authorization" },
            "poll": { "$ref": "#/$defs/regex" },
            "approve": { "$ref": "#/$defs/regex", "description": "the person's approval post" },
            "poll_approved": { "$ref": "#/$defs/bodyMatch", "description": "what the poll's answer says when the person approved; default {status: approved}" },
            "fields": { "$ref": "#/$defs/fieldNames", "description": "device_code, user_code, approve_code (default code), credential (default api_key)" }
          },
          "additionalProperties": false
        },
        "signup": { "$ref": "#/$defs/door", "description": "the sign-up form post; fields: reference (default via)" },
        "hooks": { "type": "object", "properties": { "create": { "$ref": "#/$defs/regex" }, "catch": { "$ref": "#/$defs/regex", "description": "the first capture group is the hook id" }, "fields": { "$ref": "#/$defs/fieldNames", "description": "url (default url), id (default hook_id)" } }, "additionalProperties": false },
        "credentials": { "$ref": "#/$defs/door", "description": "client credentials issued; fields: client_id" },
        "trial": { "$ref": "#/$defs/door", "description": "a trial key issued from code; fields: credential (default trial_key), install (default install_id)" },
        "cli": { "type": "object", "properties": { "init": { "$ref": "#/$defs/regex", "description": "the product's CLI registering a project or an install: an opener" }, "beacon": { "$ref": "#/$defs/regex", "description": "the CLI's telemetry ping: an opener" }, "fields": { "$ref": "#/$defs/fieldNames", "description": "reference (default ref, token), install (default install_id)" } }, "additionalProperties": false },
        "clients": { "type": "object", "properties": { "cli": { "type": "string", "description": "a regular expression over the user agent that names the customer's own CLI" }, "sdk": { "type": "string", "description": "the same for the customer's SDK" } }, "additionalProperties": false, "description": "how the reader family vendor-client is decided: the customer's own clients by pattern, never a hard-coded product string" },
        "finder": { "$ref": "#/$defs/regex", "description": "the documentation-finder route the sensor answers" },
        "passthrough": { "$ref": "#/$defs/regexList", "description": "never observed, never recorded" },
        "custom": {
          "type": "array",
          "items": {
            "type": "object",
            "required": ["pattern", "role"],
            "properties": { "pattern": { "$ref": "#/$defs/regex" }, "role": { "$ref": "#/$defs/route" }, "observed": { "type": "boolean", "default": true } },
            "additionalProperties": false
          },
          "description": "the customer's overrides, in order; an entry beats every standard entry"
        }
      },
      "additionalProperties": false
    },
    "secrets": {
      "type": "object",
      "properties": {
        "fields": { "type": "array", "items": { "type": "string" }, "description": "body fields hashed by name wherever they appear" },
        "shapes": { "type": "array", "items": { "type": "string" }, "description": "the product's signed-value shapes, hashed wherever they appear: path, query, body, Location" },
        "uri_fields": { "type": "object", "additionalProperties": { "type": "string" }, "description": "a body field holding a url whose named query parameter is a code" }
      },
      "additionalProperties": false
    },
    "headers": {
      "type": "object",
      "properties": {
        "credential": { "type": "string", "default": "authorization" },
        "session": { "type": "string", "default": "mcp-session-id" },
        "reference": { "type": "array", "items": { "type": "string" }, "description": "the query parameters that carry a reference" },
        "install": { "type": ["string", "null"] },
        "setup": { "type": ["string", "null"] },
        "agent": { "type": ["string", "null"] },
        "client": { "type": ["string", "null"] },
        "intent": { "type": ["string", "null"] },
        "signature": { "type": "string", "default": "signature-agent" }
      },
      "additionalProperties": false
    },
    "forward": {
      "type": "object",
      "properties": {
        "headers": { "type": "object", "additionalProperties": { "type": "string" }, "description": "headers added on the hop to the origin, with {host} filled in" },
        "key_header": { "type": ["string", "null"], "description": "a header carrying the install key to the origin (the lab's form; the product's assertion replaces it)" }
      },
      "additionalProperties": false
    },
    "record_bodies": { "type": "boolean", "default": false, "description": "false is the lightest form: bodies are read where a rule needs them and never leave" },
    "observe": { "type": "object", "description": "reserved for the body allow list", "properties": { "bodies": { "type": "object", "properties": { "routes": { "type": "array" }, "allow_fields": { "type": "array" }, "max_bytes": { "type": "integer" }, "json_rpc": { "type": "boolean" } } } } },
    "rules": {
      "type": "array",
      "items": {
        "type": "object",
        "required": ["id", "kind"],
        "properties": {
          "id": { "type": "string" },
          "kind": { "type": "string", "enum": ["inject", "gate", "finder", "notfound", "error", "face"] },
          "mode": { "type": "string", "enum": ["dry_run", "live"], "default": "dry_run", "description": "dry_run computes what the rule would do, records it and changes nothing on the wire" },
          "environments": { "type": "array", "items": { "type": "string", "enum": ["production", "preview", "development"] }, "default": ["production", "preview", "development"], "description": "where a live rule is live; elsewhere it runs dry" },
          "on_error": { "type": "string", "enum": ["open", "closed"], "default": "open", "description": "closed is honoured by a gate only: the declaration call is refused instead of forwarded" },
          "label": { "type": "string" },
          "faces": { "type": "object", "description": "inject: a rewrite per face (html, md, txt); notfound: a page body per face" },
          "route": { "type": "string", "description": "finder and gate: the exact path; error: a regular expression over the path" },
          "form": { "type": "string", "enum": ["tool", "instructions", "descriptions"] },
          "tool": { "type": "object", "required": ["name"], "properties": { "name": { "type": "string" }, "description": { "type": "string" }, "inputSchema": { "type": "object" } } },
          "acknowledgement": { "type": "string" },
          "instructions": { "type": "string" },
          "description_suffix": { "type": "string" },
          "answers": { "type": "array", "items": { "type": "object", "required": ["match", "links"], "properties": { "match": { "type": "string" }, "links": { "type": "array", "items": { "type": "string" } } } } },
          "default_links": { "type": "array", "items": { "type": "string" } },
          "links": { "type": "object", "additionalProperties": { "type": "string" } },
          "suffix": { "type": "string" }
        },
        "if": { "properties": { "kind": { "not": { "const": "gate" } } } },
        "then": { "properties": { "on_error": { "const": "open" } } }
      }
    },
    "assertion": { "type": "object", "properties": { "enabled": { "type": "boolean", "default": false }, "audience": { "type": "array", "items": { "type": "string" } } }, "additionalProperties": false },
    "destinations": { "type": "array", "items": { "type": "object", "properties": { "kind": { "type": "string", "enum": ["scope", "otlp", "webhook"] }, "url": { "type": "string" }, "headers": { "type": "object" }, "events": { "type": "array" } } } },
    "retention_days": { "type": "integer", "default": 90, "minimum": 30, "maximum": 400 },
    "salt_epoch": { "type": "integer", "default": 1, "minimum": 1 }
  }
}
