{
  "schema": "scope.policy/1",
  "version": 1,
  "about": "The leak fixture for the no-secret-in-policy test: a toy policy whose forward header carries a planted install key. The scanner must find exactly this one value.",
  "origin": null,
  "surfaces": { "docs": { "paths": ["^/docs(/|$)"] }, "passthrough": [] },
  "secrets": { "fields": [], "shapes": [], "uri_fields": {} },
  "headers": { "credential": "authorization", "session": "mcp-session-id", "reference": ["ref"], "signature": "signature-agent" },
  "forward": { "headers": { "x-acme-edge": "sjk_live_planted0000000000000000000000000000" } },
  "record_bodies": false,
  "rules": []
}
